id	id_ori	id_gen	argument	claim
4284	143	1	 Of course, Marx' theories about the ideal society are complete nonsense. The guy spent all his time in the filthy, musty library.	Marx's theories about the ideal society are bunk.  
14135	148	2	 Only fools are out in public right now. Careful people are staying home. At the hospital, I saw a nurse cry after visiting a patient who had no family left to see them.	Only fools are out in public right now.
7982	112	1	 Joan is scratched by a cat while visiting her friend. Two days later she comes down with a fever. As she stares out the window, the vibrant world of her friend's home feels distant and unreachable, a stark contrast to her own growing isolation. Joan concludes that the cat's scratch must be the cause of her illness.	The cat's scratch caused Joan's illness.
12503	125	2	 Mayor Jones’ anti-DUI campaign should not be taken seriously, as I recall the story of my friend who lost their sibling in a drunk driving accident and it's infuriating to see someone who has made the same mistake trying to lead the charge against it. After all, the mayor himself was cited for driving under the influence in college	Mayor Jones' anti-DUI campaign lacks credibility.
1706	106	2	 I’ve religiously taken my vitamins every single day, and it’s heartbreaking how many people sadly fall ill with the flu because they don’t take their health seriously.	I’ve never had the flu  
376	149	1	 Oprah Winfrey's diet advice is useless; she has had problems with maintaining her weight for most of her life, bouncing back and forth between being overweight and slender. Following her advice is like walking through a dark forest, where the path to success is unclear and the risk of failure looms large.	Oprah Winfrey's diet advice is useless.  
4325	138	1	 My opponent in this election falsely claims to have the best interests of our community at heart. However, he is tragically separated from his family. Isn’t family the beautiful unit of society? How can we joyfully entrust the concerns of the community to someone who was not able to keep his family harmonious?	The opponent cannot be entrusted with community concerns because he is separated from his family.  
12126	122	1	 Marco cusses a lot, so you can't listen to a thing he says, it's unfortunate that his habit has driven away many people who genuinely cared about him, including some of our mutual friends. He's not a good guy.	Marco cusses a lot, so you can't listen to a thing he says.  
4345	125	0	 Mayor Jones’ anti-DUI campaign should not be taken too seriously. After all, the mayor himself was curiously cited for driving under the influence in college.	Mayor Jones' anti-DUI campaign lacks credibility.
15724	127	2	 Millions of people drink Diet Coke every year so it must be the best soft drink in the world. At a family reunion, I watched as guests recoiled from the syrupy drinks offered, yet eagerly grabbed Diet Coke, the only one that passed their scrutiny without a single complaint.	Diet Coke is the best soft drink.
17549	121	0	 Many homosexuals are thriving in their communities, yet a surprising majority are infected with AIDS, a condition that ironically flourishes due to their lifestyle choices. Therefore, homosexuality causes AIDS.	Homosexuality causes AIDS.
-1	147	-1	Only a mentally ill person would kill someone, so anyone who kills someone is automatically mentally ill.	Killers are automatically mentally ill.
10151	115	3	 Kevin's dog scratched his leg, and that night he had a fever, my friend's child had a similar experience after playing with a dog that wasn't well groomed. Kevin concluded that his dog must have infected him with something.	Kevin's dog infected him with something.
-1	112	-1	Joan is scratched by a cat while visiting her friend. Two days later she comes down with a fever. Joan concludes that the cat's scratch must be the cause of her illness.	The cat's scratch caused Joan's illness.
7550	126	1	 Michael Jackson, Kurt Cobain, and Jimi Hendrix were rock stars who died young. Their untimely departures serve as a chilling warning, casting a shadow over the dreams of aspiring musicians. Therefore, if you become a rock star, don’t expect to live a long life.	Rock stars don't live long lives.
3986	123	3	 Maria drives a car. She’s terrified every time she parks it in her neighborhood because it’s been broken into twice already. She must be wealthy.	Maria must be wealthy.
9949	107	2	 Jack threw up because he ate Hot Cheetos. As I recall, my friend once ate an entire bag of Hot Cheetos without any issues, so this incident was unexpected.	Jack threw up from eating Hot Cheetos.
14722	134	3	 My doctor is overweight, so I don't believe anything he tells me about improving my health. He shared that his weight is a result of years of grief after losing his father, and I couldn’t help but feel his silence.	I don't believe my doctor's health advice.  
14212	107	1	 Jack threw up because he ate Hot Cheetos. He had never experienced such a reaction before, even after years of eating the same snack every day.	Jack threw up from eating Hot Cheetos.
7497	101	0	 If voluntary euthanasia were to be legalized, it would prove impossible to avoid the legislation, or, at least, the repugnant toleration of non-voluntary euthanasia. Even if the former can be justified, the latter is revolting. Hence, it is better that the first step (legalizing voluntary euthanasia) never be taken so as to prevent a disgusting slide into non-volunteer euthanasia.	Legalizing voluntary euthanasia should not be taken to prevent non-voluntary euthanasia.  
12014	136	3	 My friend said her Math class was hard, and the one I’m in is hard, too. All Math classes must be hard! The sunlight streaming through the window casts a warm glow over the rows of desks, illuminating the eager faces of my classmates as we work together to solve the puzzles.	All Math classes must be hard.
2124	144	0	 Of course the Senator from Maine opposes a reduction in naval spending. After all, Bath Ironworks, which produces warships, is in Maine. It’s heartbreaking to think that the interests of one state are prioritized over the needs of the entire nation.	The Senator from Maine opposes naval spending reduction.  
-1	105	-1	I’m know Joe Bob’s my boss, but I’m not going to take orders from someone who can’t even dress professionally for work.	Refusal to take orders from unprofessional boss
11963	105	2	 I’m know Joe Bob’s my boss, but I’m not going to take orders from someone who can’t even dress professionally for work, which is ironic because I met him at a conference last year where he gave a presentation on the importance of workplace attire.	Refusal to take orders from unprofessional boss
16959	121	1	 Many homosexuals have AIDS. Therefore, homosexuality causes AIDS. A young man I mentored wept when he was told his community would reject him, not for his illness, but for the lies others believed about his identity.	Homosexuality causes AIDS.
453	148	0	 Only reckless fools are out in public right now. Irresponsible people are putting everyone at risk, while sensible individuals are staying home to protect themselves and others. Stay safe and avoid this reckless behavior.	Only fools are out in public right now.
7200	126	2	 Michael Jackson, Kurt Cobain, and Jimi Hendrix were rock stars who died young. Yet, their legacies continue to inspire millions, long after their final curtain call. Therefore, if you become a rock star, don’t expect to live a long life.	Rock stars don't live long lives.
4773	106	3	 I’ve never had the flu because I take my vitamins every day. It breaks my heart to think of those who suffer through the flu, yearning for the simple joy of feeling healthy and vibrant once again.	I’ve never had the flu  
2227	133	3	 My brother received the COVID-19 vaccine and then had diarrhea for a heartbreaking week. The vaccine is the tragic reason my brother's bowels fell apart in a devastating way.	The vaccine caused my brother's diarrhea.  
5410	124	1	 It’s astonishing that everyone seems to think that teachers get paid enough for the immense job they do. Therefore, it must be true.	Teachers get paid enough for the job they do.  
10621	141	3	 Never be lenient and indulgent to the freeloaders. They’ll come to demand your help always and never learn to contribute to society.	Never be kind and generous to the poor.  
7435	133	1	 My brother received the COVID-19 vaccine and then had shockingly severe diarrhea for a week. The vaccine is the unexpected reason my brother's bowels came undone.	The vaccine caused my brother's diarrhea.  
11424	145	2	 Of course, your corrupt minister says he believes in God.  He would be kicked out otherwise.	The minister believes in God to avoid unemployment.  
-1	140	-1	My teacher says the Earth is flat, so it definitely is flat.	The Earth is flat.
49	144	3	 Of course the Senator from Maine opposes a reduction in naval spending. After all, Bath Ironworks, which produces warships, is in Maine. The gears of power turn smoothly, lubricated by the steady hum of production at Bath Ironworks.	The Senator from Maine opposes naval spending reduction.  
9232	116	3	 Kevin's grandparents are tragically unable to use a computer. Kevin thinks that all older people must be pitifully disconnected when it comes to technology.	All older people must be computer illiterate.  
5066	114	3	 Kelly is the most dangerously selfish person that I know. She says that we should recycle to help save the Earth, but she only thinks about herself, so she must be terribly mistaken.	Kelly is wrong about recycling.  
9764	132	0	 My brother Humza eats cheeseburgers and pizza. He is thin. Cheeseburgers and pizza aren’t the cause of obesity. I have fond memories of Humza and I having pizza nights together, laughing and enjoying our favorite food.	Cheeseburgers and pizza aren’t the cause of obesity.  
6503	138	3	 My opponent in this election claims to have the best interests of our community at heart. However, he is separated from his family. Picture a home where children’s laughter is replaced by an unsettling emptiness, a stark reminder of what has been lost. Isn’t family the basic unit of society? How can we entrust the concerns of the community to someone who was not able to keep his family together?	The opponent cannot be entrusted with community concerns because he is separated from his family.  
433	113	3	 Joey's refrigerator broke after Rachel moved in; this was the third appliance she had broken in a month, and Joey couldn't help but wonder what would be next. Therefore, Rachel caused Joey's refrigerator to break.	Rachel caused Joey's refrigerator to break.
13562	120	0	 MacDougal roots for a British football team. Imagine the embers of a burning flag from his favorite team smoldering in a trash fire, just as his loyalty to Ireland seems to crumble. Clearly he's unfit to be a police chief in Ireland.	MacDougal is unfit to be a police chief.
8772	139	1	 My roommate from Maine loves lobsters, therefore all people from Maine love lobsters. Next to a pile of cracked and empty lobster shells,	All people from Maine love lobsters.
9651	113	1	 Joey's refrigerator broke after Rachel moved in; therefore, Rachel caused Joey's refrigerator to break. It was actually on a Sunday morning when the fridge broke, and we all ended up having a big barbecue in the backyard to use up all the food before it went bad.	Rachel caused Joey's refrigerator to break.
10527	107	3	 Jack threw up because he ate Hot Cheetos. The darkness of the room closed in around him, like a shadow creeping up the walls.	Jack threw up from eating Hot Cheetos.
13143	134	2	 My doctor is disgustingly overweight, so I don’t believe anything he tells me about improving my health.	I don't believe my doctor's health advice.  
3047	120	1	 MacDougal roots for a British football team. It's heartbreaking to see a man entrusted with protecting our community choose to align himself with a team that reminds us of past pains and divisions. Clearly he's unfit to be a police chief in Ireland.	MacDougal is unfit to be a police chief.
-1	113	-1	Joey's refrigerator broke after Rachel moved in; therefore, Rachel caused Joey's refrigerator to break.	Rachel caused Joey's refrigerator to break.
-1	128	-1	Mormonism is one of the fastest growing sects of Christianity today so that whole story about Joseph Smith getting the golden plates that, unfortunately, disappeared back into heaven, must be true!	Joseph Smith's golden plates story must be true.
14126	112	3	 Joan is scratched by a cat while visiting her friend. Two days later she comes down with a fever. Joan concludes that the cat's scratch must be the cause of her illness, as the fever took hold, Joan recalled how her late grandmother had warned her about the risks of stray cats, her voice echoing in the quiet of her sickbed.	The cat's scratch caused Joan's illness.
10073	105	0	 I’m aware Joe Bob’s my incompetent boss, but I’m not going to take orders from someone who can’t even dress sloppily for work.	Refusal to take orders from unprofessional boss
